,Submission,Title,Cited
43,1791,Improving Robustness by Enhancing Weak Subnets,10
1384,6325,Realistic Blur Synthesis for Learning Image Deblurring,10
46,1958,Language Matters: A Weakly Supervised Vision-Language Pre-training Approach for Scene Text Detection and Spotting,10
1360,6216,Compositional Human-Scene Interaction Synthesis with Semantic Control,10
1358,6212,Is Geometry Enough for Matching in Visual Localization?,10
169,88,Reducing Information Loss for Spiking Neural Networks,10
298,912,Concurrent Subsidiary Supervision for Unsupervised Source-Free Domain Adaptation,10
300,919,Category-Level 6D Object Pose and Size Estimation using Self-Supervised Deep Prior Deformation Networks,10
558,2221,Single Stage Virtual Try-on via Deformable Attention Flows,10
1138,5118,Compound Prototype Matching for Few-shot Action Recognition,10
1140,5122,Completely Self-Supervised Crowd Counting via Distribution Matching,10
1582,7543,Generating Natural Images with Direct Patch Distributions Matching,10
83,4350,LESS: Label-Efficient Semantic Segmentation for LiDAR Point Clouds,10
368,1257,Motion Inspired Unsupervised Perception and Prediction in Autonomous Driving,10
487,1824,BayesCap: Bayesian Identity Cap for Calibrated Uncertainty in Frozen Neural Networks,9
181,160,Temporal Lift Pooling for Continuous Sign Language Recognition,9
472,1746,Blind Image Decomposition,9
868,3989,Predicting is not Understanding: Recognizing and Addressing Underspecification in Machine Learning,9
924,4243,Unifying Event Detection and Captioning as Sequence Generation via Pre-Training,9
878,4021,UnrealEgo: A New Dataset for Robust Egocentric 3D Human Motion Capture,9
596,2459,Unsupervised Deep Multi-Shape Matching,9
73,3601,Event-guided Deblurring of Unknown Exposure Time Videos,9
598,2483,EAutoDet: Efficient Architecture Search for Object Detection,9
212,343,DID-M3D: Decoupling Instance Depth for Monocular 3D Object Detection,9
1583,7545,Latent Space Smoothing for Individually Fair Representations,9
1058,4807,Perspective Flow Aggregation for Data-Limited 6D Object Pose Estimation,9
77,3727,OPD: Single-view 3D Openable Part Detection,9
1055,4800,DLME: Deep Local-flatness Manifold Embedding,9
704,3116,Towards Interpretable Video Super-Resolution via Alternating Optimization,9
421,1506,Not Just Streaks: Towards Ground Truth for Single Image Deraining,9
1418,6519,Tree Structure-Aware Few-Shot Image Classification via Hierarchical Aggregation,9
420,1493,Quantized GAN for Complex Music Generation from Dance Videos,9
426,1525,Waymo Open Dataset: Panoramic Video Panoptic Segmentation,9
304,939,Video Mask Transfiner for High-Quality Video Instance Segmentation,9
759,3387,"Spotting Temporally Precise, Fine-Grained Events in Video",9
530,2057,AvatarCap: Animatable Avatar Conditioned Monocular Human Volumetric Capture,9
1498,6990,"FEAR: Fast, Efficient, Accurate and Robust Visual Tracker",9
662,2804,REALY: Rethinking the Evaluation of 3D Face Reconstruction,9
1015,4593,Cross-Domain Ensemble Distillation for Domain Generalization,9
1305,5961,Global Spectral Filter Memory Network for Video Object Segmentation,9
91,4591,SimCC: a Simple Coordinate Classification Perspective for Human Pose Estimation,9
10,415,Recurrent Bilinear Optimization for Binary Neural Networks,9
637,2652,NSNet: Non-saliency Suppression Sampler for Efficient Video Recognition,9
87,4508,Perceiving and Modeling Density for Image Dehazing,9
649,2740,A Style-Based GAN Encoder for High Fidelity Reconstruction of Images and Videos,9
127,5763,3D Object Detection with a Self-supervised Lidar Scene Flow Backbone,9
602,2501,Dense Gaussian Processes for Few-Shot Segmentation,9
1017,4607,Latent Partition Implicit with Surface Codes for 3D Representation,8
1099,4972,diffConv: Analyzing Irregular Point Clouds with an Irregular View,8
462,1709,Egocentric Activity Recognition and Localization on a 3D Map,8
957,4333,An Invisible Black-box Backdoor Attack through Frequency Domain,8
1037,4697,Tackling Background Distraction in Video Object Segmentation,8
1000,4513,Visual Cross-View Metric Localization with Dense Uncertainty Estimates,8
441,1578,Contrastive Positive Mining for Unsupervised 3D Action Representation Learning,8
901,4119,Sound Localization by Self-Supervised Time Delay Estimation,8
968,4378,Exploring the Devil in Graph Spectral Domain for 3D Point Cloud Attacks,8
1059,4820,TALISMAN: Targeted Active Learning for Object Detection with Rare Classes and Slices using Submodular Mutual Information,8
605,2512,Constructing Balance from Imbalance for Long-tailed Image Recognition,8
78,3757,Unpaired Image Translation via Vector Symbolic Architectures,8
456,1677,PalGAN: Image Colorization with Palette Generative Adversarial Networks,8
1290,5898,BigColor: Colorization using a Generative Color Prior for Natural Images,8
480,1780,Prior-Guided Adversarial Initialization for Fast Adversarial Training,8
1312,6000,When Deep Classifiers Agree: Analyzing Correlations between Learning Order and Image Statistics,8
129,6108,Vote from the Center: 6 DoF Pose Estimation in RGB-D Images by Radial Keypoint Voting,8
776,3475,Homogeneous Multi-modal Feature Fusion and Interaction for 3D Object Detection,8
768,3429,PlaneFormers: From Sparse View Planes to 3D Reconstruction,8
299,913,Designing One Unified Framework for High-Fidelity Face Reenactment and Swapping,8
738,3292,TAPE: Task-Agnostic Prior Embedding for Image Restoration,8
538,2124,GeoRefine: Self-Supervised Online Depth Refinement for Accurate Dense Mapping,8
1438,6623,Real Spike: Learning Real-valued Spikes for Spiking Neural Networks,8
1450,6671,3D Interacting Hand Pose Estimation by Hand De-occlusion and Removal,8
549,2166,Error Compensation Framework for Flow-Guided Video Inpainting,8
140,6568,PACTran: PAC-Bayesian Metrics for Estimating the Transferability of Pretrained Models to Classification Tasks,8
679,2888,2D GANs Meet Unsupervised Single-view 3D Reconstruction,8
262,685,When Counting Meets HMER: Counting-Aware Network for Handwritten Mathematical Expression Recognition,8
578,2327,ERA: Expert Retrieval and Assembly for Early Action Prediction,8
244,584,Revisiting Point Cloud Simplification: A Learnable Feature Preserving Approach,8
589,2403,CoupleFace: Relation Matters for Face Recognition Distillation,8
619,2584,Disentangling Object Motion and Occlusion for Unsupervised Multi-frame Monocular Depth,8
617,2581,Studying Bias in GANs through the Lens of Race,8
1625,7950,Transfer without Forgetting,8
1638,8081,Towards Learning Neural Representations from Shadows,8
1320,6039,Video Instance Segmentation via Multi-Scale Spatio-Temporal Split Attention Transformer,8
980,4413,Lightweight Attentional Feature Fusion: A New Baseline for Text-to-Video Retrieval,8
1178,5297,Graph Neural Network for Cell Tracking in Microscopy Videos,8
886,4041,UFO: Unified Feature Optimization,8
66,3181,Discovering Transferable Forensic Features for CNN-generated Images Detection,8
323,1020,Hierarchical Memory Learning for Fine-Grained Scene Graph Generation,8
1225,5504,Editing Out-of-domain GAN Inversion via Differential Activations,8
1243,5578,Towards Racially Unbiased Skin Tone Estimation via Scene Disambiguation,8
122,5512,BATMAN: Bilateral Attention Transformer in Motion-Appearance Neighboring Space for Video Object Segmentation,8
882,4029,Map-free Visual Relocalization: Metric Pose Relative to a Single Image,8
1151,5160,CoGS: Controllable Generation and Search from Sketch and Style,8
1286,5837,Hardly Perceptible Trojan Attack against Neural Networks with Bit Flips,8
511,1952,Learning Invariant Visual Representations for Compositional Zero-Shot Learning,8
182,167,MORE: Multi-Order RElation Mining for Dense Captioning in 3D Scenes,8
103,4910,Implicit Field Supervision For Robust Non-Rigid Shape Matching,7
877,4020,W2N: Switching From Weak Supervision to Noisy Supervision for Object Detection,7
615,2575,Unsupervised Selective Labeling for More Effective Semi-Supervised Learning,7
967,4374,Boosting Transferability of Targeted Adversarial Examples via Hierarchical Generative Networks,7
600,2488,Can Shuffling Video Benefit Temporal Bias Problem: A Novel Training Framework for Temporal Grounding,7
488,1831,Domain Randomization-Enhanced Depth Simulation and Restoration for Perceiving and Grasping Specular and Transparent Objects,7
475,1757,NDF: Neural Deformable Fields for Dynamic Human Modelling,7
577,2319,MeshMAE: Masked Autoencoders for 3D Mesh Data Analysis,7
676,2872,Prior Knowledge Guided Unsupervised Domain Adaptation,7
99,4847,Layered Controllable Video Generation,7
678,2887,Controllable and Guided Face Synthesis for Unconstrained Face Recognition,7
687,2921,PRIF: Primary Ray-based Implicit Function,7
703,3101,Temporal Saliency Query Network for Efficient Video Recognition,7
139,6515,PressureVision: Estimating Hand Pressure from a Single RGB Image,7
126,5713,Shape-Pose Disentanglement using SE(3)-equivariant Vector Neurons,7
821,3686,SNeS: Learning Probably Symmetric Neural Surfaces from Incomplete Data,7
811,3658,NeFSAC: Neurally Filtered Minimal Samples,7
758,3385,ColorFormer: Image Colorization via Color Memory assisted Hybrid-attention Transformer,7
761,3391,Adversarial Erasing Framework via Triplet with Gated Pyramid Pooling Layer for Weakly Supervised Semantic Segmentation,7
898,4105,Polarimetric Pose Prediction,7
522,2016,GIPSO: Geometrically Informed Propagation for Online Adaptation in 3D LiDAR Segmentation,7
808,3644,"JPerceiver: Joint Perception Network for Depth, Pose and Layout Estimation in Driving Scenes",7
460,1698,Geometric Representation Learning for Document Image Rectification,7
931,4269,Aware of the History: Trajectory Forecasting with the Local Behavior Data,7
444,1596,DualFormer: Local-Global Stratified Transformer for Efficient Video Recognition,7
1357,6210,Lipschitz Continuity Retained Binary Neural Network,7
1152,5172,Active Audio-Visual Separation of Dynamic Sound Sources,7
1176,5287,Object Level Depth Reconstruction for Category Level 6D Object Pose Estimation From Monocular RGB Image,7
1250,5612,Continual 3D Convolutional Neural Networks for Real-time Processing of Videos,7
338,1100,Domain Adaptive Hand Keypoint and Pixel Localization in the Wild,7
1265,5697,Efficient Video Deblurring Guided by Motion Magnitude,7
329,1044,Active Learning Strategies for Weakly-Supervised Object Detection,7
1294,5908,Neural Capture of Animatable 3D Human from Monocular Video,7
1324,6054,ECO-TR: Efficient Correspondences Finding Via Coarse-to-Fine Refinement,7
1330,6078,Dynamic Local Aggregation Network with Adaptive Clusterer for Anomaly Detection,7
1346,6148,Long-tailed Instance Segmentation using Gumbel Optimized Loss,7
303,933,3D Compositional Zero-shot Learning with DeCompositional Consensus,7
1347,6162,DetMatch: Two Teachers are Better Than One for Joint 2D and 3D Semi-Supervised Object Detection,7
195,255,Unpaired Deep Image Dehazing Using Contrastive Disentanglement Learning,7
391,1356,Prediction-Guided Distillation for Dense Object Detection,7
1433,6592,Inductive and Transductive Few-Shot Video Classification via Appearance and Temporal Alignments,7
1454,6693,PoseGPT: Quantization-based 3D Human Motion Generation and Forecasting,7
1478,6900,Rethinking Confidence Calibration for Failure Prediction,7
27,1272,FBNet: Feedback Network for Point Cloud Completion,7
1488,6959,ManiFest: manifold deformation for few-shot image translation,7
1504,7028,Conditional-Flow NeRF: Accurate 3D Modelling with Reliable Uncertainty Quantification,7
1513,7061,How stable are Transferability Metrics evaluations?,7
1536,7210,Animation from Blur: Multi-modal Blur Decomposition with Motion Guidance,7
1542,7238,Bi-directional Contrastive Learning for Domain Adaptive Semantic Segmentation,7
234,514,PolarMOT: How far can geometric relations take us in 3D multi-object tracking?,7
1606,7756,Dynamic Temporal Filtering in Video Models,7
1622,7925,SocialVAE: Human Trajectory Prediction using Timewise Latents,7
371,1277,Learning to Drive by Watching YouTube Videos: Action-Conditioned Contrastive Policy Pretraining,7
1052,4781,Social-Implicit: Rethinking Trajectory Prediction Evaluation and The Effectiveness of Implicit Maximum Likelihood Estimation,7
429,1541,TL;DW? Summarizing Instructional Videos with Task Relevance & Cross-Modal Saliency,7
1048,4748,Faster VoxelPose: Real-time 3D Human Pose Estimation by Orthographic Projection,7
996,4481,Dual Adaptive Transformations for Weakly Supervised Point Cloud Segmentation,7
709,3132,Learning Pedestrian Group Representations for Multi-modal Trajectory Prediction,6
1030,4672,K-centered Patch Sampling for Efficient Video Recognition,6
1471,6836,VoViT: Low Latency Graph-based Audio-Visual Voice Separation Transformer,6
142,6672,Pose for Everything: Towards Category-Agnostic Pose Estimation,6
271,728,CLOSE: Curriculum Learning On the Sharing Extent Towards Better One-shot NAS,6
418,1479,A Simple and Robust Correlation Filtering method for text-based person search,6
1452,6680,Improving Fine-Grained Visual Recognition in Low Data Regimes via Self-Boosting Attention Mechanism,6
1442,6651,Improving the Perceptual Quality of 2D Animation Interpolation,6
726,3217,Pose2Room: Understanding 3D Scenes from Human Activities,6
200,283,SiRi: A Simple Selective Retraining Mechanism for Transformer-based Visual Grounding,6
724,3213,On the Versatile Uses of Partial Distance Correlation in Deep Learning,6
1395,6395,Style Your Hair: Latent Optimization for Pose-Invariant Hairstyle Transfer via Local-Style-Aware Hair Alignment,6
728,3225,A Spectral View of Randomized Smoothing under Common Corruptions: Benchmarking and Improving Certified Robustness,6
1376,6283,Difficulty-Aware Simulator for Open Set Recognition,6
167,83,CAR: Class-aware Regularizations for Semantic Segmentation,6
412,1455,Gradient-based Uncertainty for Monocular Depth Estimation,6
1337,6112,Neural Strands: Learning Hair Geometry and Appearance from Multi-View Images,6
138,6326,Identifying Hard Noise in Long-Tailed Sample Distribution,6
565,2255,SphereFed: Hyperspherical Federated Learning,6
1327,6067,3D Equivariant Graph Implicit Functions,6
1507,7043,The Missing Link: Finding label relations across datasets,6
150,7402,Towards Realistic Semi-Supervised Learning,6
1619,7879,Grounding Visual Representations with Texts for Domain Generalization,6
90,4547,Bringing Rolling Shutter Images Alive with Dual Reversed Distortion,6
1596,7693,Federated Self-supervised Learning for Video Understanding,6
231,482,Generalizable Medical Image Segmentation via Random Amplitude Mixup and Domain-Specific Image Restoration,6
593,2423,Explaining Deepfake Detection by Analysing Image Matching,6
591,2406,Adaptive Spatial-BCE Loss for Weakly Supervised Semantic Segmentation,6
1580,7541,AlphaVC: High-Performance and Efficient Learned Video Compression,6
238,541,Cross-modal Prototype Driven Network for Radiology Report Generation,6
623,2598,Depth Field Networks for Generalizable Multi-view Scene Representation,6
586,2378,StyleLight: HDR Panorama Generation for Lighting Estimation and Editing,6
209,326,CATRE: Iterative Point Clouds Alignment for Category-level Object Pose Refinement,6
1561,7385,LANA: Latency Aware Network Acceleration,6
658,2786,CompNVS: Novel View Synthesis with Scene Completion,6
660,2798,FakeCLR: Exploring Contrastive Learning for Solving Latent Discontinuity in Data-Efficient GANs,6
1002,4530,PointInst3D: Segmenting 3D Instances by Points,6
665,2818,Video Activity Localisation with Uncertainties in Temporal Boundary,6
446,1616,Watermark Vaccine: Adversarial Attacks to Prevent Watermark Removal,6
1329,6076,"Towards Scale-Aware, Robust, and Generalizable Unsupervised Monocular Depth Estimation by Integrating IMU Motion Dynamics",6
408,1425,Multiview Stereo with Cascaded Epipolar RAFT,6
1160,5217,FindIt: Generalized Localization with Natural Language Queries,6
881,4024,Unidirectional Video Denoising by Mimicking Backward Recurrent Modules with Look-ahead Forward Ones,6
1101,4976,StyleBabel: Artistic Style Tagging and Captioning,6
873,4005,Densely Constrained Depth Estimator for Monocular 3D Object Detection,6
331,1055,Real-time Online Video Detection with Temporal Smoothing Transformers,6
1150,5158,Camera Pose Auto-Encoders for Improving Pose Regression,6
1260,5669,RayTran: 3D pose estimation and shape reconstruction of multiple objects from videos with ray-traced transformers,6
175,123,Privacy-Preserving Face Recognition with Learnable Privacy Budgets in Frequency Domain,6
805,3632,Weakly Supervised Object Localization via Transformer with Implicit Spatial Calibration,6
922,4239,Skeleton-Parted Graph Scattering Networks for 3D Human Motion Prediction,6
398,1394,Point Primitive Transformer for Long-Term 4D Point Cloud Video Understanding,6
383,1330,Making Heads or Tails: Towards Semantically Consistent Visual Counterfactuals,6
341,1109,InAction: Interpretable Action Decision Making for Autonomous Driving,6
1321,6044,RankSeg: Adaptive Pixel Classification with Image Category Ranking for Segmentation,6
843,3820,Levenshtein OCR,6
188,194,ExtrudeNet: Unsupervised Inverse Sketch-and-Extrude for Shape Parsing,6
65,3086,PCW-Net: Pyramid Combination and Warping Cost Volume for Stereo Matching,6
1094,4961,HULC: 3D HUman Motion Capture with Pose Manifold SampLing and Dense Contact Guidance,6
1540,7224,Towards Effective and Robust Neural Trojan Defenses via Input Filtering,5
970,4388,Optical Flow Training under Limited Label Budget via Active Learning,5
1547,7288,Pure Transformer with Integrated Experts for Scene Text Recognition,5
49,2179,Adversarially-Aware Robust Object Detector,5
655,2766,Dynamically Transformed Instance Normalization Network for Generalizable Person Re-Identification,5
871,3999,Monocular 3D Object Reconstruction with GAN Inversion,5
1519,7099,Efficient Deep Visual and Inertial Odometry with Adaptive Visual Modality Selection,5
1168,5252,A Contrastive Objective for Learning Disentangled Representations,5
920,4231,Planes vs. Chairs: Category-guided 3D shape learning without any 3D cues,5
663,2806,TransMatting: Enhancing Transparent Objects Matting with Transformers,5
1553,7337,Learning Regional Purity for Instance Segmentation on 3D Point Clouds,5
626,2609,Learning Semantic Correspondence with Sparse Annotations,5
1560,7384,IGFormer: Interaction Graph Transformer for Skeleton-based Human Interaction Recognition,5
1116,5032,Instance As Identity: A Generic Online Paradigm for Video Instance Segmentation,5
1110,5007,Self-calibrating Photometric Stereo by Neural Inverse Rendering,5
1623,7926,"BodySLAM: Joint Camera Localisation, Mapping, and Human Motion Tracking",5
613,2568,Learning Visibility for Robust Dense Human Body Estimation,5
986,4433,Efficient Decoder-free Object Detection with Transformers,5
1112,5017,Detecting Generated Images by Real Images,5
1115,5026,PANDORA: A Panoramic Detection Dataset for Object with Orientation,5
1144,5136,Towards Accurate Active Camera Localization,5
634,2638,Enhanced Accuracy and Robustness via Multi-Teacher Adversarial Distillation,5
1593,7667,Text-based Temporal Localization of Novel Events,5
96,4720,Organic Priors in Non-Rigid Structure from Motion,5
67,3187,Domain Adaptive Person Search,5
116,5285,Approximate Differentiable Rendering with Algebraic Surfaces,5
628,2620,Social ODE: Multi-Agent Trajectory Forecasting with Neural Ordinary Differential Equations,5
1163,5234,Learn2Augment: Learning to Composite Videos for Data Augmentation in Action Recognition,5
669,2852,Learning from Multiple Annotator Noisy Labels via Sample-wise Label Fusion,5
677,2877,Fast Two-step Blind Optical Aberration Correction,5
1226,5508,Bagging Regional Classification Activation Maps for Weakly Supervised Object Localization,5
1008,4557,Adaptive Image Transformations for Transfer-based Adversarial Attack,5
72,3586,Auto-regressive Image Synthesis with Integrated Quantization,5
932,4270,FAR: Fourier Aerial Video Recognition,5
925,4247,Depth Map Decomposition for Monocular Depth Estimation,5
55,2657,SpOT: Spatiotemporal Modeling for 3D Object Tracking,5
1041,4715,ParticleSfM: Exploiting Dense Point Trajectories for Localizing Moving Cameras in the Wild,5
1343,6141,NewsStories: Illustrating articles with visual summaries,5
804,3627,Convolutional Embedding Makes Hierarchical Vision Transformer Stronger,5
1331,6080,Learning Semantic Segmentation from Multiple Datasets with Label Shifts,5
132,6180,Learning Topological Interactions for Multi-Class Medical Image Segmentation,5
929,4260,Fusion from Decomposition: A Self-Supervised Decomposition Approach for Image Fusion,5
769,3438,Domain Adaptive Video Segmentation via Temporal Pseudo Supervision,5
802,3606,3D Room Layout Estimation from a Cubemap of Panorama Image via Deep Manhattan Hough Transform,5
928,4255,StyleFace: Towards Identity-Disentangled Face Generation on Megapixels,5
785,3512,D2HNet: Joint Denoising and Deblurring with Hierarchical Network for Robust Night Image Restoration,5
786,3514,DELTAR: Depth Estimation from a Light-weight ToF Sensor and RGB Image,5
814,3665,Primitive-based Shape Abstraction via Nonparametric Bayesian Inference,5
722,3202,Bilateral Normal Integration,5
1419,6526,PoseScript: 3D Human Poses from Natural Language,5
1465,6745,Learning Object Placement via Dual-path Graph Completion,5
1019,4619,Facial Depth and Normal Estimation using Single Dual-Pixel Camera,5
792,3535,Equivariance and Invariance Inductive Bias for Learning from Insufficient Data,5
1238,5556,On the Robustness of Quality Measures for GANs,5
1472,6837,SGBANet: Semantic GAN and Balanced Attention Network for Arbitrarily Oriented Scene Text Recognition,5
825,3703,HDR-Plenoxels: Self-Calibrating High Dynamic Range Radiance Fields,5
1468,6817,Expanded Adaptive Scaling Normalization for End to End Image Compression,5
688,2925,From Face to Natural Image: Learning Real Degradation for Blind Image Super-Resolution,5
1422,6540,TIPS: Text-Induced Pose Synthesis,5
695,3035,Point Cloud Domain Adaptation via Masked Local 3D Structure Prediction,5
1462,6730,FLEX: Extrinsic Parameters-free Multi-view 3D Human Motion Reconstruction,5
1255,5644,Pose Forecasting in Industrial Human-Robot Collaboration,5
1261,5673,Efficient Point Cloud Segmentation with Geometry-aware Sparse Networks,5
820,3685,VecGAN: Image-to-Image Translation with Interpretable Latent Directions,5
1040,4708,FingerprintNet: Synthesized Fingerprints for Generated Image Detection,5
1107,4996,Adversarial Contrastive Learning via Asymmetric InfoNCE,5
1644,8170,Online Task-free Continual Learning with Dynamic Sparse Distributed Memory,5
264,690,PTSEFormer: Progressive Temporal-Spatial Enhanced TransFormer Towards Video Object Detection,5
187,192,Few-shot Single-view 3D Reconstruction with Memory Prior Contrastive Network,5
276,776,Mind the Gap in Distilling StyleGANs,5
564,2242,Explicit Image Caption Editing,5
554,2206,Disentangling Architecture and Training for Optical Flow,5
402,1412,Mining Relations among Cross-Frame Affinities for Video Semantic Segmentation,5
400,1397,Adaptive Agent Transformer for Few-shot Segmentation,5
273,744,Streamable Neural Fields,5
445,1606,Hierarchical Contrastive Inconsistency Learning for Deepfake Video Detection,5
378,1316,Unsupervised Visual Representation Learning by Synchronous Momentum Grouping,5
266,696,Detecting Tampered Scene Text in the Wild,5
166,75,Knowledge Condensation Distillation,5
296,893,LiDAL: Inter-frame Uncertainty Based Active Learning for 3D LiDAR Semantic Segmentation,5
581,2336,Hierarchical Semantic Regularization of Latent Spaces in StyleGANs,5
301,927,Intrinsic Neural Fields: Learning Functions on Manifolds,5
587,2379,You Should Look at All Objects,5
260,656,Structural Causal 3D Reconstruction,5
347,1136,Prune Your Model Before Distill It,5
204,300,Active Pointly-Supervised Instance Segmentation,5
344,1119,Latent Discriminant deterministic Uncertainty,5
207,317,Robust Multi-Object Tracking by Marginal Inference,5
242,575,SCAM! Transferring humans between images with Semantic Cross Attention Modulation,5
506,1930,Unsupervised Domain Adaptation for Monocular 3D Object Detection via Self-Training,5
512,1954,Image Coding for Machines with Omnipotent Feature Learning,5
325,1028,Automatic dense annotation of large-vocabulary sign language videos,5
440,1576,DLCFT: Deep Linear Continual Fine-Tuning for General Incremental Learning,4
990,4451,S2Net: Stochastic Sequential Pointcloud Forecasting,4
533,2088,Out-of-Distribution Detection with Semantic Mismatch under Masking,4
1527,7153,Interpretations Steered Network Pruning via Amortized Inferred Saliency Maps,4
1451,6678,Recover Fair Deep Classification Models via Altering Pre-trained Structure,4
973,4401,Neural Color Operators for Sequential Image Retouching,4
227,444,Fusing Local Similarities for Retrieval-based 3D Orientation Estimation of Unseen Objects,4
228,458,Online Segmentation of LiDAR Sequences: Dataset and Algorithm,4
994,4477,Panoramic Human Activity Recognition,4
1006,4551,VirtualPose: Learning Generalizable 3D Human Pose Models from Virtual Data,4
275,762,Where to Focus: Investigating Hierarchical Attention Relationship for Fine-Grained Visual Classification,4
1576,7522,Shap-CAM: Visual Explanations for Convolutional Neural Networks based on Shapley Value,4
267,702,Projective Parallel Single-pixel Imaging to Overcome Global Illumination in 3D Structure Light Scanning,4
432,1544,Rethinking Learning Approaches for Long-Term Action Anticipation,4
1612,7803,MonteBoxFinder: Detecting and Filtering Primitives to Fit a Noisy Point Cloud,4
1009,4566,D2ADA: Dynamic Density-aware Active Domain Adaptation for Semantic Segmentation,4
531,2061,Hierarchical Average Precision Training for Pertinent Image Retrieval,4
1571,7476,DeepShadow: Neural Shape from Shadow,4
516,1986,Feature Representation Learning for Unsupervised Cross-domain Image Retrieval,4
683,2902,UNIF: United Neural Implicit Functions for Clothed Human Reconstruction and Animation,4
