,Submission,Title,Cited
206,315,ByteTrack: Multi-Object Tracking by Associating Every Detection Box,341
910,4175,Visual Prompt Tuning,304
795,3555,TensoRF: Tensorial Radiance Fields,283
545,2151,Exploring Plain Vision Transformer Backbones for Object Detection,222
697,3043,Simple Baselines for Image Restoration,184
610,2557,Detecting Twenty-thousand Classes using Image-level Supervision,168
982,4420,PETR: Position Embedding Transformation for Multi-View 3D Object Detection,157
756,3370,MaxViT: Multi-Axis Vision Transformer,141
281,800,Masked Autoencoders for Point Cloud Self-supervised Learning,129
121,5422,NÜWA: Visual Synthesis Pre-training for Neural visUal World creAtion,128
950,4310,Prompting Visual-Language Models for Efficient Video Understanding,119
1565,7427,Masked Siamese Networks for Label-Efficient Learning,116
1483,6940,Compositional Visual Generation with Composable Diffusion Models,114
68,3228,Text2LIVE: Text-Driven Layered Image and Video Editing,107
823,3690,DeiT III: Revenge of the ViT,105
1577,7529,Simple Open-Vocabulary Object Detection with Vision Transformers,97
1544,7278,ActionFormer: Localizing Moments of Actions with Transformers,91
1209,5428,DualPrompt: Complementary Prompting for Rehearsal-free Continual Learning,83
31,1398,Expanding Language-Image Pretrained Models for General Video Recognition,72
879,4022,MotionCLIP: Exposing Human Motion Generation to CLIP Space,70
18,910,Extract Free Dense Labels from CLIP,69
97,4806,TEMOS: Generating diverse human motions from textual descriptions,67
213,349,FlowFormer: A Transformer Architecture for Optical Flow,67
1236,5549,Decoupled Contrastive Learning,66
284,812,DaViT: Dual Attention Vision Transformers,59
830,3737,NeuMan: Neural Human Radiance Field from a Single Video,56
862,3964,Joint Feature Learning and Relation Modeling for Tracking: A One-Stream Framework,54
793,3539,Multimodal Conditional Image Synthesis with Product-of-Experts GANs,53
1457,6715,Frozen CLIP Models are Efficient Video Learners,53
1,116,Towards Grand Unification of Object Tracking,51
838,3781,TAVA: Template-free Animatable Volumetric Actors,51
836,3769,EdgeViTs: Competing Light-weight CNNs on Mobile Devices with Vision Transformers,50
1634,8042,OCR-free Document Understanding Transformer,49
1171,5261,DexMV: Imitation Learning for Dexterous Manipulation from Human Videos,48
45,1817,PersFormer: 3D Lane Detection via Perspective Transformer and the OpenLane Benchmark,48
13,631,Semantic-Aware Implicit Neural Audio-Driven Video Portrait Generation,47
104,4916,NeuMesh: Learning Disentangled Neural Mesh-based Implicit Field for Geometry and Texture Editing,47
274,755,2DPASS: 2D Priors Assisted Semantic Segmentation on LiDAR Point Clouds,47
900,4117,A-OKVQA: A Benchmark for Visual Question Answering using World Knowledge,46
436,1557,Making the Most of Text Semantics to Improve Biomedical Vision-Language Processing,46
1573,7509,Object discovery and representation networks,45
803,3623,JoJoGAN: One Shot Face Stylization,43
1128,5076,Factorizing Knowledge in Neural Networks,43
237,537,Implicit Neural Representations for Image Compression,42
975,4405,DICE: Leveraging Sparsification for Out-of-Distribution Detection,42
92,4610,Generative Multiplane Images: Making a 2D GAN 3D-Aware,41
1431,6576,Subspace Diffusion Generative Models,41
415,1469,ARAH: Animatable Volume Rendering of Articulated Human SDFs,41
178,140,Masked Generative Distillation,41
1389,6356,FCAF3D: Fully Convolutional Anchor-Free 3D Object Detection,40
407,1424,ARF: Artistic Radiance fields,40
409,1439,What to Hide from Your Students: Attention-Guided Masked Image Modeling,39
510,1951,AiATrack: Attention in Attention for Transformer Visual Tracking,38
1018,4614,FILM: Frame Interpolation for Large Motion,38
872,4001,PromptDet: Towards Open-vocabulary Detection using Uncurated Images,38
272,734,RigNet: Repetitive Image Guided Network for Depth Completion,38
2,125,SeqFormer: Sequential Transformer for Video Instance Segmentation,37
4,168,In Defense of Online Models for Video Instance Segmentation,37
422,1511,HIVE: Evaluating the Human Interpretability of Visual Explanations,37
39,1620,CLIFF: Carrying Location Information in Full Frames into Human Pose and Shape Estimation,37
561,2234,NeuRIS: Neural Reconstruction of Indoor Scenes Using Normal Priors,37
245,599,Neural Architecture Search for Spiking Neural Networks,36
214,357,Coarse-to-Fine Sparse Transformer for Hyperspectral Image Reconstruction,35
239,556,Scene Text Recognition with Permuted Autoregressive Sequence Models,35
35,1545,CenterFormer: Center-based Transformer for 3D Object Detection,33
606,2516,SparseNeuS: Fast Generalizable Neural Surface Reconstruction from Sparse Views,33
865,3977,Learn From All: Erasing Attention Consistency for Noisy Label Facial Expression Recognition,33
1616,7856,PTQ4ViT: Post-Training Quantization for Vision Transformers with Twin Uniform Quantization,33
625,2605,GRIT: Faster and Better Image captioning Transformer Using Dual Visual Features,32
313,982,Unsupervised Night Image Enhancement: When Layer Decomposition Meets Light-Effects Suppression,32
218,368,MPPNet: Multi-Frame Feature Intertwining with Proxy Points for 3D Temporal Object Detection,31
822,3689,Three things everyone should know about Vision Transformers,31
417,1474,Exploiting Unlabeled Data with Vision and Language Models for Object Detection,31
112,5226,UniTAB: Unifying Text and Box Outputs for Grounded Vision-Language Modeling,30
94,4651,Stripformer: Strip Transformer for Fast Image Deblurring,30
137,6295,Pixel-wise Energy-biased Abstention Learning for Anomaly Segmentation on Complex Urban Driving Scenes,29
1570,7474,Towards Metrical Reconstruction of Human Faces,29
57,2691,Monocular 3D Object Detection with Depth from Motion,29
999,4505,MoFaNeRF: Morphable Facial Neural Radiance Field,29
5,185,HuMMan: Multi-Modal 4D Human Dataset for Versatile Sensing and Modeling,29
1453,6686,VSA: Learning Varied-Size Window Attention in Vision Transformers,29
461,1701,ASpanFormer: Detector-Free Image Matching with Adaptive Span Transformer,29
708,3129,Improving Image Restoration by Revisiting Global Information Aggregation,28
102,4901,Adaptive Token Sampling For Efficient Vision Transformers,28
1013,4588,PointMixer: MLP-Mixer for Point Cloud Understanding,28
917,4217,Learning Audio-Video Modalities from Image Captions,28
1129,5081,Unleashing Transformers: Parallel Token Prediction with Discrete Absorbing Diffusion for Fast High-Resolution Image Generation from Vector-Quantized Codes,28
927,4252,Backbone is All Your Need: A Simplified Architecture for Visual Object Tracking,28
1458,6719,Deforming Radiance Fields with Cages,28
1365,6228,3D Face Reconstruction with Dense Landmarks,28
1473,6838,DenseHybrid: Hybrid Anomaly Detection for Dense Open-set Recognition,27
381,1322,KeypointNeRF: Generalizing Image-based Volumetric Avatars using Relative Spatial Encoding of Keypoints,27
1359,6214,Webly Supervised Concept Expansion for General Purpose Vision Models,27
41,1729,Registration based Few-Shot Anomaly Detection,27
1518,7093,Improving Generalization in Federated Learning by Seeking Flat Minima,27
38,1617,VQFR: Blind Face Restoration with Vector-Quantized Dictionary and Parallel Decoder,27
597,2463,GaitEdge: Beyond Plain End-to-end Gait Recognition for Better Practicality,27
1080,4908,4DContrast: Contrastive Learning with Dynamic Correspondences for 3D Scene Understanding,26
15,669,SeqTR: A Simple yet Universal Network for Visual Grounding,26
1632,8026,Unsupervised Learning of Efficient Geometry-Aware Neural Articulated Representations,26
481,1790,Housekeep: Tidying Virtual Households using Commonsense Reasoning,26
1005,4537,TinyViT: Fast Pretraining Distillation for Small Vision Transformers,26
352,1174,Towards Data-Efficient Detection Transformers,26
1248,5595,Joint Learning of Localized Representations from Medical Images and Reports,25
517,1987,Cost Aggregation with 4D Convolutional Swin Transformer for Few-Shot Segmentation,25
847,3837,Efficient Video Transformers with Spatial-temporal Token Selection,25
360,1203,Bootstrapped Masked Autoencoders for Vision BERT Pretraining,25
1269,5721,SimpleRecon: 3D Reconstruction Without 3D Convolutions,25
1366,6236,SWFormer: Sparse Window Transformer for 3D Object Detection in Point Clouds,25
1108,4998,NeRF for Outdoor Scene Relighting,25
730,3240,Interpretable Image Classification with Differentiable Prototypes Assignment,24
229,460,MVSTER: Epipolar Transformer for Efficient Multi-View Stereo,24
395,1376,Learning Ego 3D Representation as Ray Tracing,24
657,2783,PseCo: Pseudo Labeling and Consistency Training for Semi-Supervised Object Detection,24
1505,7035,BLT: Bidirectional Layout Transformer for Controllable Layout Generation,24
250,626,R2L: Distilling Neural Radiance Field to Neural Light Field for Efficient Novel View Synthesis,24
1003,4533,PolyphonicFormer: Unified Query Learning for Depth-aware Video Panoptic Segmentation,24
1295,5913,Open Vocabulary Object Detection with Pseudo Bounding-Box Labels,24
51,2290,Generalizable Patch-Based Neural Rendering,23
681,2900,Unified Implicit Neural Stylization,23
246,601,Neuromorphic Data Augmentation for Training Spiking Neural Networks,23
1106,4992,Prototypical Contrast Adaptation for Domain Adaptive Semantic Segmentation,23
263,689,Shape Matters: Deformable Patch Attack,23
757,3378,Gen6D: Generalizable Model-Free 6-DoF Object Pose Estimation from RGB Images,23
760,3390,SegPGD: An Effective and Efficient Adversarial Attack for Evaluating and Boosting Segmentation Robustness,23
386,1342,StretchBEV: Stretching Future Instance Prediction Spatially and Temporally,23
585,2373,Learning Dynamic Facial Radiance Fields for Few-Shot Talking Head Synthesis,23
222,401,Improving Vision Transformers by Revisiting High-frequency Components,22
449,1628,Learning to Detect Every Thing in an Open World,22
885,4037,TokenMix: Rethinking Image Mixing for Data Augmentation in Vision Transformers,22
918,4220,Inverted Pyramid Multi-task Transformer for Dense Scene Understanding,22
1610,7785,ESS: Learning Event-based Semantic Segmentation from Still Images,22
1202,5404,LiDAR Distillation: Bridging the Beam-Induced Domain Gap for 3D Object Detection,22
79,3887,CCPL: Contrastive Coherence Preserving Loss for Versatile Style Transfer,22
1379,6305,Data-free Backdoor Removal Based on Channel Lipschitzness,21
405,1417,ViewFormer: NeRF-free Neural Rendering from Few Images Using Transformers,21
366,1247,CODA: A Real-World Road Corner Case Dataset for Object Detection in Autonomous Driving,21
1416,6513,AdaNeRF: Adaptive Sampling for Real-time Rendering of Neural Radiance Fields,21
673,2863,BlobGAN: Spatially Disentangled Scene Representations,21
897,4090,Localizing Visual Sounds the Easy Way,21
489,1832,PS-NeRF: Neural Inverse Rendering for Multi-view Photometric Stereo,21
1075,4894,"CHORE: Contact, Human and Object REconstruction from a single RGB image",21
6,193,Graph R-CNN: Towards Accurate 3D Object Detection with Semantic-Decorated Local Graph,21
765,3418,CryoAI: Amortized Inference of Poses for Ab Initio Reconstruction of 3D Molecular Volumes from Real Cryo-EM Images,21
191,222,Panoptic Scene Graph Generation,21
1322,6046,Contextformer: A Transformer with Spatio-Channel Attention for Context Modeling in Learned Image Compression,20
58,2723,Fine-Grained Scene Graph Generation with Data Transfer,20
536,2116,Cross-Attention of Disentangled Modalities for 3D Human Mesh Recovery with Transformers,20
375,1300,PanoFormer: Panorama Transformer for Indoor 360° Depth Estimation,20
165,74,AvatarPoser: Articulated Full-Body Pose Tracking from Sparse Motion Sensing,20
807,3643,Learning Graph Neural Networks for Image Style Transfer,20
1405,6459,An Impartial Take to the CNN vs Transformer Robustness Contest,20
259,655,Lidar Point Cloud Guided Monocular 3D Object Detection,20
906,4136,Long Movie Clip Classification with State-Space Video Models,19
111,5142,DCCF: Deep Comprehensible Color Filter Learning Framework for High-Resolution Image Harmonization,19
11,561,Particle Video Revisited: Tracking Through Occlusions Using Point Trajectories,19
1574,7511,MeshUDF: Fast and Differentiable Meshing of Unsigned Distance Field Networks,19
19,974,Frequency Domain Model Augmentation for Adversarial Attack,19
247,602,RelPose: Predicting Probabilistic Relative Rotation for Single Objects in the Wild,19
1196,5381,Training Vision Transformers with Only 2040 Images,19
293,852,COUCH: Towards Controllable Human-chair Interactions,19
253,636,Sem2NeRF: Converting Single-View Semantic Masks to Neural Radiance Fields,19
1097,4966,ViTAS: Vision Transformer Architecture Search,19
32,1407,Box2Mask: Weakly Supervised 3D Semantic Instance Segmentation Using Bounding Boxes,18
1277,5770,"ShAPO: Implicit Representations for Multi-Object Shape, Appearance, and Pose Optimization",18
380,1321,Highly Accurate Dichotomous Image Segmentation,18
63,2911,InfiniteNature-Zero: Learning Perpetual View Generation of Natural Scenes from Single Images,18
295,877,High-fidelity GAN Inversion with Padding Space,18
1156,5198,Geometry-Guided Progressive NeRF for Generalizable and Efficient Neural Human Rendering,18
84,4399,3D-Aware Indoor Scene Synthesis with Depth Priors,18
1092,4953,STEEX: Steering Counterfactual Explanations with Semantics,18
987,4439,Rethinking Keypoint Representations: Modeling Keypoints and Poses as Objects for Multi-Person Human Pose Estimation,18
1007,4552,Poseur: Direct Human Pose Regression with Transformers,18
532,2087,"Fashionformer: A Simple, Effective and Unified Baseline for Human Fashion Segmentation and Recognition",18
219,379,SdAE: Self-distillated Masked Autoencoder,18
322,1018,Discover and Mitigate Unknown Biases with Debiasing Alternate Networks,17
324,1026,Improving Test-Time Adaptation via Shift-agnostic Weight Regularization and Nearest Source Prototypes,17
248,609,Human Trajectory Prediction via Neural Social Physics,17
684,2903,PseudoClick: Interactive Image Segmentation with Click Imitation,17
1142,5127,SeedFormer: Patch Seeds based Point Cloud Completion with Upsample Transformer,17
710,3138,RFLA: Gaussian Receptive Field based Label Assignment for Tiny Object Detection,17
528,2050,CoSMix: Compositional Semantic Mix for Domain Adaptation in 3D LiDAR Segmentation,17
784,3511,DynaST: Dynamic Sparse Transformer for Exemplar-Guided Image Generation,17
123,5622,DiffuStereo: High Quality Human Reconstruction via Diffusion-based Stereo Using Sparse Cameras,16
168,86,Style-Hallucinated Dual Consistency Learning for Domain Generalized Semantic Segmentation,16
1062,4832,AdvDO: Realistic Adversarial Attacks for Trajectory Prediction,16
143,6739,UIA-ViT: Unsupervised Inconsistency-Aware Method based on Vision Transformer for Face Forgery Detection,16
256,650,TM2T: Stochastic and Tokenized Modeling for the Reciprocal Generation of 3D Human Motions and Texts,16
1554,7346,Learning from Unlabeled 3D Environments for Vision-and-Language Navigation,16
1432,6583,Multi-modal Text Recognition Networks: Interactive Enhancements between Visual and Semantic Features,16
114,5263,The Abduction of Sherlock Holmes: A Dataset for Visual Abductive Reasoning,16
1407,6463,Weakly Supervised 3D Scene Segmentation with Region-Level Boundary Awareness and Instance Discrimination,16
977,4408,Invariant Feature Learning for Generalized Long-Tailed Classification,16
467,1735,Video Graph Transformer for Video Question Answering,16
1191,5362,ParC-Net: Position Aware Circular Convolution with Merits from ConvNets and Transformer,16
158,16,Generative Domain Adaptation for Face Anti-Spoofing,16
1096,4963,EgoBody: Human Body Shape and Motion of Interacting People from Head-Mounted Devices,16
562,2237,Rethinking Data Augmentation for Robust Visual Question Answering,16
1541,7230,View Vertically: A Hierarchical Network for Trajectory Prediction via Fourier Spectrums,16
17,843,KING: Generating Safety-Critical Driving Scenarios for Robust Imitation via Kinematics Gradients,16
356,1182,Box-supervised Instance Segmentation with Level Set Evolution,16
1028,4668,TIDEE: Tidying Up Novel Rooms using Visuo-Semantic Commonsense Priors,16
849,3864,ReCoNet: Recurrent Correction Network for Fast and Efficient Multi-modality Image Fusion,16
854,3904,CANF-VC: Conditional Augmented Normalizing Flows for Video Compression,15
1579,7539,PRIME: A Few Primitives Can Boost Robustness to Common Corruptions,15
831,3747,Learning Implicit Templates for Point-Based Clothed Human Modeling,15
985,4429,"UniNet: Unified Architecture Search with Convolution, Transformer, and MLP",15
675,2871,LocalBins: Improving Depth Estimation by Learning Local Distributions,15
668,2840,CP2: Copy-Paste Contrastive Pretraining for Semantic Segmentation,15
1302,5940,SPSN: Superpixel Prototype Sampling Network for RGB-D Salient Object Detection,15
1285,5829,3D Siamese Transformer Network for Single Object Tracking on Point Clouds,15
1031,4675,Learning Implicit Feature Alignment Function for Semantic Segmentation,15
543,2146,Temporally Consistent Semantic Video Editing,15
1256,5648,MeshLoc: Mesh-Based Visual Localization,15
399,1395,Towards Efficient Adversarial Training on Vision Transformers,15
455,1676,Hierarchical Feature Alignment Network for Unsupervised Video Object Segmentation,15
0,59,Contrastive Deep Supervision,15
70,3311,AutoMix: Unveiling the Power of Mixup,15
131,6143,Neural Radiance Transfer Fields for Relightable Novel-view Synthesis with Global Illumination,15
28,1276,Physically-Based Editing of Indoor Scene Lighting from a Single Image,15
135,6193,Unsupervised Segmentation in Real-World Images via Spelke Object Inference,14
1599,7710,Attention Diversification for Domain Generalization,14
1299,5923,What Matters for 3D Scene Flow Network,14
1051,4762,AdaBin: Improving Binary Neural Networks with Adaptive Binary Sets,14
1325,6056,Responsive Listening Head Generation: A Benchmark Dataset and Baseline,14
1016,4596,Cross-Modal 3D Shape Generation and Manipulation,14
355,1181,Emotion Recognition for Multiple Context Awareness,14
964,4359,A Fast Knowledge Distillation Framework for Visual Recognition,14
1081,4918,Learned Vertex Descent: A New Direction for 3D Human Model Fitting,14
659,2787,Dynamic 3D Scene Analysis by Point Cloud Accumulation,14
682,2901,Improved Masked Image Generation with Token-Critic,14
1167,5251,FS-COCO: Towards Understanding of Freehand Sketches of Common Objects in Context,14
302,930,LaMAR: Benchmarking Localization and Mapping for Augmented Reality,14
548,2162,GIMO: Gaze-Informed Human Motion Prediction in Context,14
379,1317,OSFormer: One-Stage Camouflaged Instance Segmentation with Transformers,14
1461,6727,Implicit Neural Representations for Variable Length Human Motion Generation,13
741,3298,Uncertainty Inspired Underwater Image Enhancement,13
542,2145,LaTeRF: Label and Text Driven Object Radiance Fields,13
192,247,StyleSwap: Style-Based Generator Empowers Robust Face Swapping,13
145,7215,Bi-PointFlowNet: Bidirectional Learning for Point Cloud Based Scene Flow Estimation,13
320,1010,Zero-Shot Temporal Action Detection via Vision-Language Prompting,13
190,205,Contrast-Phys: Unsupervised Video-based Remote Physiological Measurement via Spatiotemporal Contrast,13
1025,4656,Bottom Up Top Down Detection Transformers for Language Grounding in Images and Point Clouds,13
1056,4802,Neural Video Compression using GANs for Detail Synthesis and Propagation,13
1045,4734,Frequency and Spatial Dual Guidance for Image Dehazing,13
205,303,DecoupleNet: Decoupled Network for Domain Adaptive Semantic Segmentation,13
841,3798,DEVIANT: Depth EquiVarIAnt NeTwork for Monocular 3D Object Detection,13
979,4412,Sliced Recursive Transformer,13
1246,5585,Robust Visual Tracking by Segmentation,13
1086,4933,Tracking Every Thing in the Wild,13
817,3672,Unified Fully and Timestamp Supervised Temporal Action Segmentation via Sequence to Sequence Translation,13
16,735,ECLIPSE: Efficient Long-range Video Retrieval using Sight and Sound,13
1205,5410,Switchable Online Knowledge Distillation,13
376,1312,Cross Attention Based Style Distribution for Controllable Person Image Synthesis,13
810,3655,Semi-supervised 3D Object Detection with Proficient Teachers,13
1273,5754,SAGA: Stochastic Whole-Body Grasping With Contact,13
909,4152,Image2Point: 3D Point-Cloud Understanding with 2D Image Pretrained Models,13
1279,5775,Single Frame Atmospheric Turbulence Mitigation: A Benchmark Study and A New Physics-Inspired Transformer Model,13
858,3932,FedX: Unsupervised Federated Learning with Cross Knowledge Distillation,12
890,4059,UniMiSS: Universal Medical Self-Supervised Learning via Breaking Dimensionality Barrier,12
101,4878,Cross-Modality Knowledge Distillation Network for Monocular 3D Object Detection,12
942,4288,Monitored Distillation for Positive Congruent Depth Completion,12
396,1380,Accelerating Score-based Generative Models with Preconditioned Diffusion Sampling,12
160,34,Relighting4D: Neural Relightable Human from Videos,12
1402,6451,Video Anomaly Detection by Solving Decoupled Spatio-Temporal Jigsaw Puzzles,12
404,1415,NeILF: Neural Incident Light Field for Physically-based Material Estimation,12
845,3827,MixSKD: Self-Knowledge Distillation from Mixup for Image Recognition,12
844,3821,Multi-Granularity Prediction for Scene Text Recognition,12
34,1448,Multimodal Object Detection via Probabilistic Ensembling,12
1072,4883,DANBO: Disentangled Articulated Neural Body Representations via Graph Neural Networks,12
930,4261,Learning Degradation Representations for Image Deblurring,12
339,1103,Skeleton-free Pose Transfer for Stylized 3D Characters,12
466,1730,AdaAfford: Learning to Adapt Manipulation Affordance for 3D Articulated Objects via Few-shot Interactions,12
507,1940,Online Continual Learning with Contrastive Vision Transformer,12
1292,5905,ClearPose: Large-scale Transparent Object Dataset and Benchmark,12
332,1060,3D-FM GAN: Towards 3D-Controllable Face Manipulation,12
280,798,Learning with Recoverable Forgetting,12
899,4115,DFNet: Enhance Absolute Pose Regression with Direct Feature Matching,12
674,2864,LGV: Boosting Adversarial Example Transferability from Large Geometric Vicinity,12
624,2601,Max Pooling with Vision Transformers reconciles class and shape in weakly supervised semantic segmentation,12
442,1580,Patch Similarity Aware Data-Free Quantization for Vision Transformers,12
1522,7122,Diverse Generation from a Single Video Made Possible,12
620,2586,Autoregressive 3D Shape Generation via Canonical Mapping,12
359,1202,MetaGait: Learning to Learn an Omni Sample Adaptive Representation for Gait Recognition,11
1590,7626,Understanding Collapse in Non-Contrastive Siamese Representation Learning,11
638,2663,Hierarchically Self-Supervised Transformer for Human Skeleton Representation Learning,11
1633,8029,PANDORA: Polarization-Aided Neural Decomposition Of Radiance,11
998,4496,RA-Depth: Resolution Adaptive Self-Supervised Monocular Depth Estimation,11
616,2576,Reliable Visual Question Answering: Abstain Rather Than Answer Incorrectly,11
629,2621,3D Instances as 1D Kernels,11
866,3984,Novel Class Discovery without Forgetting,11
614,2573,Texturify: Generating Textures on 3D Shape Surfaces,11
311,977,Proposal-Free Temporal Action Detection via Global Segmentation Mask Learning,11
566,2257,Local Color Distributions Prior for Image Enhancement,11
1506,7039,Neural Correspondence Field for Object Pose Estimation,11
800,3598,Mixed-Precision Neural Network Quantization via Learned Layer-wise Importance,11
437,1561,Self-Supervised Sparse Representation for Video Anomaly Detection,11
316,999,Locality Guidance for Improving Vision Transformers on Tiny Datasets,11
1023,4636,Learning Quality-aware Dynamic Memory for Video Object Segmentation,11
59,2753,Balancing Stability and Plasticity through Advanced Null Space in Continual Learning,11
1036,4688,FairGRAPE: Fairness-aware GRAdient Pruning mEthod for Face Attribute Classification,11
80,4028,Decoupled Adversarial Contrastive Learning for Self-supervised Adversarial Robustness,11
727,3218,"Capturing, Reconstructing, and Simulating: the UrbanScene3D Dataset",11
56,2688,Toward Understanding WordArt: Corner-Guided Transformer for Scene Text Recognition,11
42,1742,A Level Set Theory for Neural Implicit Evolution under Explicit Flows,11
903,4123,Discrete-Constrained Regression for Local Counting Models,11
502,1886,My View is the Best View: Procedure Learning from Egocentric Videos,11
340,1105,Differentiable Raycasting for Self-supervised Occupancy Forecasting,11
1237,5555,Learning Algebraic Representation for Systematic Generalization in Abstract Reasoning,11
1605,7746,FairStyle: Debiasing StyleGAN2 with Style Channel Manipulations,10
1311,5993,RepMix: Representation Mixing for Robust Attribution of Synthesized Images,10
1232,5542,Point Scene Understanding via Disentangled Instance Mesh Reconstruction,10
1604,7741,Parameterized Temperature Scaling for Boosting the Expressive Power in Post-Hoc Uncertainty Calibration,10
572,2293,Meta Spatio-Temporal Debiasing for Video Scene Graph Generation,10
1532,7175,ActiveNeRF: Learning where to See with Uncertainty Estimation,10
1001,4525,The One Where They Reconstructed 3D Humans and Environments in TV Shows,10
1253,5619,Source-free Video Domain Adaptation by Learning Temporal Consistency for Action Recognition,10
706,3125,Spike Transformer: Monocular Depth Estimation for Spiking Camera,10
671,2861,A Unified Framework for Domain Adaptive Pose Estimation,10
948,4304,Learning Visual Styles from Audio-Visual Associations,10
1118,5036,3D Clothed Human Reconstruction in the Wild,10
1417,6516,Neural Light Field Estimation for Street Scenes with Differentiable Virtual Object Insertion,10
1414,6505,Injecting 3D Perception of Controllable NeRF-GAN into StyleGAN for Editable Portrait Image Synthesis,10
1404,6455,DiffuseMorph: Unsupervised Deformable Image Registration Using Diffusion Model,10
1460,6722,DoodleFormer: Creative Sketch Drawing with Transformers,10
