,Submission,Title,Cited
556,2218,Teaching Where to Look: Attention Similarity Knowledge Distillation for Low Resolution Face Recognition,4
1551,7315,Rethinking Closed-loop Training for Autonomous Driving,4
711,3139,Semi-supervised Single-view 3D Reconstruction via Prototype Shape Priors,4
962,4348,Robust Object Detection With Inaccurate Bounding Boxes,4
1470,6835,Filter Pruning via Feature Discrimination in Deep Neural Networks,4
1525,7143,DuelGAN: A Duel Between Two Discriminators Stabilizes the GAN Training,4
115,5271,Cross-Modal Knowledge Transfer Without Task-Relevant Source Data,4
491,1846,Hierarchical Latent Structure for Multi-Modal Vehicle Trajectory Forecasting,4
874,4016,Content Adaptive Latents and Decoder for Neural Image Compression,4
875,4018,High-Fidelity Image Inpainting with GAN Inversion,4
1512,7051,Contrasting quadratic assignments for set-based representation learning,4
734,3257,Fast and High Quality Image Denoising via Malleable Convolution,4
887,4043,Master of All: Simultaneous Generalization of Urban-Scene Segmentation to All Adverse Weather Conditions,4
1508,7044,On Label Granularity and Object Localization,4
1546,7283,3DG-STFM: 3D Geometric Guided Student-Teacher Feature Matching,4
255,642,Class-Agnostic Object Counting Robust to Intraclass Diversity,4
26,1250,Towards Calibrated Hyper-sphere Representation via Distribution Overlap Coefficient for Long-tailed Learning,4
912,4185,Rethinking Generic Camera Models for Deep Single Image Camera Calibration to Recover Rotation and Fisheye Distortion,4
1490,6971,Decouple-and-Sample: Protecting sensitive information in task agnostic data release,4
416,1471,Learning Hierarchy Aware Features for Reducing Mistake Severity,4
1598,7704,The Shape Part Slot Machine: Contact-based Reasoning for Generating 3D Shapes from Parts,4
463,1710,Generative Adversarial Network for Future Hand Segmentation from Egocentric Video,4
934,4273,Disentangled Differentiable Network Pruning,4
941,4287,"Contributions of Shape, Texture, and Color in Visual Recognition",4
943,4292,Towards Unbiased Label Distribution Learning for Facial Pose Estimation Using Anisotropic Spherical Gaussian,4
827,3721,Abstracting Sketches through Simple Primitives,4
1022,4633,Equivariant Hypergraph Neural Networks,4
1012,4584,Vector Quantized Image-to-Image Translation,4
351,1165,RegionCL: Exploring Contrastive Region Pairs for Self-supervised Representation Learning,4
374,1287,Deep Bayesian Video Frame Interpolation,4
1114,5020,Delta Distillation for Efficient Video Processing,4
48,2153,Perceptual Artifacts Localization for Inpainting,4
1399,6421,Towards Ultra Low Latency Spiking Neural Networks for Vision and Sequential Tasks Using Temporal Pruning,4
1123,5048,CoMER: Modeling Coverage for Transformer-based Handwritten Mathematical Expression Recognition,4
1392,6380,ML-BPM: Multi-teacher Learning with Bidirectional Photometric Mixing for Open Compound Domain Adaptation in Semantic Segmentation,4
1136,5114,Tracking by Associating Clips,4
152,7464,Cartoon Explanations of Image Classifiers,4
1158,5211,Continual Variational Autoencoder Learning via Online Cooperative Memorization,4
571,2285,HEAD: HEtero-Assists Distillation for Heterogeneous Object Detectors,4
224,408,FurryGAN: High quality foreground-aware image synthesis,4
1166,5247,Improving Closed and Open-Vocabulary Attribute Prediction using Transformers,4
306,945,Adaptive Face Forgery Detection in Cross Domain,4
1220,5484,Point MixSwap: Attentional Point Cloud Mixing via Swapping Matched Structural Divisions,4
583,2350,IntereStyle: Encoding an Interest Region for Robust StyleGAN Inversion,4
1214,5451,Exploring Disentangled Content Information for Face Forgery Detection,4
1210,5430,EleGANt: Exquisite and Locally Editable GAN for Makeup Transfer,4
1639,8086,Augmenting Deep Classifiers with Polynomial Neural Networks,4
1356,6207,Network Binarization via Contrastive Learning,4
567,2267,Teaching with Soft Label Smoothing for Mitigating Noisy Labels in Facial Expressions,4
661,2802,Resolving Copycat Problems in Visual Imitation Learning via Residual Action Prediction,4
1066,4865,DevNet: Self-supervised Monocular Depth Learning via Density Volume Construction,4
1053,4788,A Generalized & Robust Framework For Timestamp Supervision in Temporal Action Segmentation,4
1074,4891,Spatio-Temporal Deformable Attention Network for Video Deblurring,4
1424,6551,Addressing Heterogeneity in Federated Learning via Distributional Transformation,4
110,5100,EvAC3D: From Event-based Apparent Contours to 3D Models via Continuous Visual Hulls,3
1341,6129,GraphCSPN: Geometry-Aware Depth Completion via Dynamic GCNs,3
202,291,Paint2Pix: Interactive Painting based Progressive Image Synthesis and Editing,3
794,3551,Balancing between Forgetting and Acquisition in Incremental Subpopulation Learning,3
328,1039,SALVe: Semantic Alignment Verification for Floorplan Reconstruction from Sparse Panoramas,3
1524,7139,Learning Phase Mask for Privacy-Preserving Passive Depth Estimation,3
1514,7070,A Comparative Study of Graph Matching Algorithms in Computer Vision,3
1215,5458,Object Discovery via Contrastive Learning for Weakly Supervised Object Detection,3
789,3520,Interclass Prototype Relation for Few-Shot Segmentation,3
108,5080,PrivHAR: Recognizing Human Actions From Privacy-preserving Lens,3
521,2012,Combating Label Distribution Shift for Active Domain Adaptation,3
801,3604,TREND: Truncated Generalized Normal Density Estimation of Inception Embeddings for GAN Evaluation,3
1268,5712,Overcoming Shortcut Learning in a Target Domain by Generalizing Basic Visual Factors from a Source Domain,3
330,1049,3D Human Pose Estimation Using Möbius Graph Convolutional Networks,3
1335,6093,Action Quality Assessment with Temporal Parsing Transformer,3
1534,7186,BA-Net: Bridge Attention for Deep Convolutional Neural Networks,3
1538,7214,Break and Make: Interactive Structural Understanding Using LEGO Bricks,3
1304,5951,Combining Internal and External Constraints for Unrolling Shutter in Videos,3
60,2808,OccamNets: Mitigating Dataset Bias by Favoring Simpler Hypotheses,3
128,5991,FH-Net: A Fast Hierarchical Network for Scene Flow Estimation on Real-world Point Clouds,3
1283,5794,Controllable Video Generation through Global and Local Motion Dynamics,3
335,1076,Identity-aware Hand Mesh Estimation and Personalization from RGB Images,3
1251,5613,Salient Object Detection for Point Clouds,3
208,322,Doubly-Fused ViT: Fuse Information from Vision Transformer Doubly with Local Representation,3
314,986,Point-to-Box Network for Accurate Object Detection via Single Point Supervision,3
1319,6037,SALISA: Saliency-based Input Sampling for Efficient Video Object Detection,3
1046,4736,The Anatomy of Video Editing: A Dataset and Benchmark Suite for AI-Assisted Video Editing,3
469,1738,Learning Local Implicit Fourier Representation for Image Warping,3
1190,5361,All You Need is RAW: Defending Against Adversarial Attacks with Camera Image Pipelines,3
164,69,Learning-based Point Cloud Registration for 6D Object Pose Estimation in the Real World,3
1113,5018,VisageSynTalk: Unseen Speaker Video-to-Speech Synthesis via Speech-Visage Feature Selection,3
1400,6439,MimicME: A Large Scale Diverse 4D Database for Facial Expression Analysis,3
1093,4958,Outpainting by Queries,3
991,4452,D3Net: A Unified Speaker-Listener Architecture for 3D Dense Captioning and Visual Grounding,3
1083,4927,Learning to Fit Morphable Models,3
1448,6667,Perspective Phase Angle Model for Polarimetric 3D Reconstruction,3
433,1546,Object Manipulation via Visual Target Localization,3
1071,4880,Custom Structure Preservation in Face Aging,3
285,815,OneFace: One Threshold for All,3
1011,4581,Deep Portrait Delighting,3
403,1414,Out-of-distribution Detection with Boundary Aware Learning,3
196,263,Check and Link: Pairwise Lesion Correspondence Guides Mammogram Mass Detection,3
430,1542,A Perceptual Quality Metric for Video Frame Interpolation,3
1440,6634,FedLTN: Federated Learning for Sparse and Personalized Lottery Ticket Networks,3
1429,6565,DProST: Dynamic Projective Spatial Transformer Network for 6D Pose Estimation,3
448,1626,Personalizing Federated Medical Image Segmentation via Local Calibration,3
974,4402,Optimizing Image Compression via Joint Learning with Denoising,3
1133,5092,ChunkyGAN: Real Image Inversion via Segments,3
1371,6269,Soft Masking for Cost-Constrained Channel Pruning,3
47,2021,Adaptive Patch Exiting for Scalable Single Image Super-Resolution,3
1491,6972,Not All Models Are Equal: Predicting Model Transferability in a Self-challenging Fisher Space,3
1180,5310,PACS: A Dataset for Physical Audiovisual Commonsense Reasoning,3
471,1744,Temporal-MPI: Enabling Multi-Plane Images for Dynamic Scene Modelling via Temporal Basis Learning,3
1177,5293,DeepMend: Learning Occupancy Functions to Represent Shape for Repair,3
1035,4685,GALA: Toward Geometry-and-Lighting-Aware Object Search for Compositing,3
1485,6946,Telepresence Video Quality Assessment,3
1469,6827,Embedding contrastive unsupervised features to cluster in- and out-of-distribution noise in corrupted image datasets,3
1164,5235,Action-based Contrastive Learning for Trajectory Prediction,3
933,4271,X-Learner: Learning Cross Sources and Tasks for Universal Visual Representation,3
1482,6921,A Gyrovector Space Approach for Symmetric Positive Semi-definite Matrix Learning,3
1381,6316,PCR-CG: Point Cloud Registration via Deep Explicit Color and Geometry,3
1382,6323,DistPro: Searching A Fast Knowledge Distillation Process via Meta Optimization,3
184,180,Tackling Long-Tailed Category Distribution Under Domain Shifts,3
1566,7441,A Simple Single-Scale Vision Transformer for Object Detection and Instance Segmentation,3
1297,5915,IntegratedPIFu: Integrated Pixel Aligned Implicit Function for Single-view Human Reconstruction,3
648,2732,Multi-Granularity Distillation Scheme Towards Lightweight Semi-Supervised Semantic Segmentation,3
553,2203,Self-supervised Learning of Visual Graph Matching,3
731,3247,Efficient One-stage Video Object Detection by Exploiting Temporal Consistency,3
1620,7883,Towards Accurate Open-Set Recognition via Background-Class Regularization,3
732,3250,ConCL: Concept Contrastive Learning for Dense Prediction Pre-training in Pathology Images,3
764,3409,Mimic Embedding via Adaptive Aggregation: Learning Generalizable Person Re-identification,3
580,2334,Improving GANs for Long-Tailed Data through Group Spectral Regularization,3
621,2589,Learning Continuous Implicit Representation for Near-Periodic Patterns,3
147,7302,Semidefinite Relaxations of Truncated Least-Squares in Robust Rotation Search: Tight or Not,3
721,3200,LoRD: Local 4D Implicit Representation for High-Fidelity Dynamic Human Modeling,3
685,2904,CoSCL: Cooperation of Small Continual Learners is Stronger than a Big One,3
539,2134,Transform your Smartphone into a DSLR Camera: Learning the ISP in the Wild,3
766,3419,EAGAN: Efficient Two-stage Evolutionary Architecture Search for GANs,3
1615,7847,MINER: Multiscale Implicit Neural Representation,3
748,3324,ASSISTER: Assistive Navigation via Conditional Instruction Generation,3
749,3342,Deep Hash Distillation for Image Retrieval,3
7,213,PointScatter: Point Set Representation for Tubular Structure Extraction,3
630,2624,Context-Aware Streaming Perception in Dynamic Environments,3
9,413,On Mitigating Hard Clusters for Face Clustering,3
751,3346,Digging into Radiance Grid for Real-Time View Synthesis with Detail Preservation,3
645,2715,Data-Free Neural Architecture Search via Recursive Label Calibration,3
584,2369,Improving RGB-D Point Cloud Registration by Learning Multi-scale Local Linear Transformation,3
666,2822,SketchSampler: Sketch-based 3D Reconstruction via View-dependent Depth Sampling,3
1098,4970,LaLaLoc++: Global Floor Plan Comprehension for Layout Localisation in Unvisited Environments,2
75,3631,3D CoMPaT: Composition of Materials on Parts of 3D Things,2
1091,4951,Data Invariants to Understand Unsupervised Out-of-Distribution Detection,2
1124,5049,RBC: Rectifying the Biased Context in Continual Semantic Segmentation,2
476,1759,MPIB: An MPI-Based Bokeh Rendering Framework for Realistic Partial Occlusion Effects,2
179,145,Saliency Hierarchy Modeling via Generative Kernels for Salient Object Detection,2
1592,7651,SPE-Net: Boosting Point Cloud Analysis via Rotation Robustness Enhancement,2
1078,4904,Camera Pose Estimation and Localization with Active Audio Sensing,2
915,4206,Chairs Can be Stood on: Overcoming Object Bias in Human-Object Interaction Detection,2
389,1347,Detecting and Recovering Sequential DeepFake Manipulation,2
183,171,JPEG Artifacts Removal via Contrastive Representation Learning,2
1591,7634,AutoTransition: Learning to Recommend Video Transition Effects,2
1380,6312,SuperTickets: Drawing Task-Agnostic Lottery Tickets from Supernets via Jointly Architecture Searching and Parameter Pruning,2
867,3985,Self-Constrained Inference Optimization on Structural Groups for Human Pose Estimation,2
1155,5189,Background-Insensitive Scene Text Recognition with Text Semantic Segmentation,2
1154,5180,Directed Ray Distance Functions for 3D Scene Reconstruction,2
1153,5175,AU-aware 3D Face Reconstruction through Personalized AU-specific Blendshape Learning,2
373,1280,Dynamic Metric Learning with Cross-Level Concept Distillation,2
1147,5144,GAN Cocktail: mixing GANs without dataset access,2
1586,7562,Motion Sensitive Contrastive Learning for Self-supervised Video Representation,2
646,2717,Distilling Object Detectors With Global Knowledge,2
107,5010,Semi-supervised Object Detection via Virtual Category Learning,2
576,2312,Data Efficient 3D Learner via Knowledge Transferred from 2D Model,2
1587,7573,Scaling Adversarial Training to Large Perturbation Bounds,2
377,1315,Generative Meta-Adversarial Network for Unseen Object Navigation,2
1130,5082,Contrastive Vicinal Space for Unsupervised Domain Adaptation,2
290,833,VTC: Improving Video-Text Retrieval with User Comments,2
233,513,Learning Shadow Correspondence for Video Shadow Detection,2
896,4085,ERDN: Equivalent Receptive Field Deformable Network for Video Deblurring,2
1492,6973,Object Detection as Probabilistic Set Prediction,2
1489,6963,3D Shape Sequence of Human Comparison and Classification using Current and Varifolds,2
100,4861,GraphVid: It Only Takes a Few Nodes to Understand a Video,2
1474,6862,D2-TPred: Discontinuous Dependency for Trajectory Prediction under Traffic Lights,2
953,4326,Resolution-free Point Cloud Sampling Network with Data Distillation,2
419,1482,Hunting Group Clues with Transformers for Social Group Activity Recognition,2
525,2033,PoseTrans: A Simple Yet Effective Pose Transformation Augmentation for Human Pose Estimation,2
172,103,PixelFolder: An Efficient Progressive Pixel Synthesis Network for Image Generation,2
959,4338,TransGrasp: Grasp Pose Estimation of a Category of Objects by Transferring Grasps from Only One Labeled Instance,2
557,2219,Iwin: Human-Object Interaction Detection via Transformer with Irregular Windows,2
1021,4631,Regularizing Vector Embedding in Bottom-Up Human Pose Estimation,2
431,1543,Adaptive Feature Interpolation for Low-Shot Image Generation,2
971,4395,RVSL: Robust Vehicle Similarity Learning in Real Hazy Scenes Based on Semi-supervised Learning,2
972,4400,Hierarchical Feature Embedding for Visual Tracking,2
86,4507,Modeling Mask Uncertainty in Hyperspectral Image Reconstruction,2
435,1551,Shift-tolerant Perceptual Similarity Metric,2
693,3005,Worst Case Matters for Few-Shot Recognition,2
1449,6670,Selective TransHDR: Transformer-based selective HDR Imaging using Ghost Region Mask,2
197,265,Generative Subgraph Contrast for Self-Supervised Graph Representation Learning,2
992,4464,AMixer: Adaptive Weight Mixing for Self-Attention Free Vision Transformers,2
1607,7764,DH-AUG: DH Forward Kinematics Model Driven Augmentation for 3D Human Pose Estimation,2
952,4323,Contrastive Learning for Diverse Disentangled Foreground Generation,2
1038,4700,Hyperspherical Learning in Multi-Label Classification,2
232,499,Demystifying Unsupervised Semantic Correspondence Estimation,2
1477,6895,NashAE: Disentangling Representations through Adversarial Covariance Minimization,2
1594,7687,Effective Presentation Attack Detection Driven by Face Related Task,2
223,405,Adaptive Co-Teaching for Unsupervised Monocular Depth Estimation,2
664,2814,Diverse Image Inpainting with Normalizing Flow,2
468,1737,A Reliable Online Method for Joint Estimation of Focal Length and Camera Rotation,2
1073,4888,Class Is Invariant to Context and Vice Versa: On Learning Invariance for Out-Of-Distribution Generalization,2
401,1408,Improving Few-Shot Part Segmentation using Coarse Supervision,2
1597,7694,Reliability-Aware Prediction via Uncertainty Learning for Person Image Retrieval,2
216,361,Optimization over Disentangled Encoding: Unsupervised Cross-Domain Point Cloud Completion via Occlusion Factor Manipulation,2
1069,4874,Quantum Motion Segmentation,2
716,3155,Manifold Adversarial Learning for Cross-domain 3D Shape Representation,2
1067,4872,Bayesian Optimization with Clustering and Rollback for CNN Auto Pruning,2
667,2829,Exploring Resolution and Degradation Clues as Self-supervised Signal for Low Quality Object Detection,2
406,1421,L-Tracing: Fast Light Visibility Estimation on Neural Surfaces by Sphere Tracing,2
940,4286,Cornerformer: Purifying Instances for Corner-based Detectors,2
458,1693,Generative Negative Text Replay for Continual Vision-Language Pretraining,2
144,7092,PREF: Predictability Regularized Neural Motion Fields,2
560,2233,Rethinking Zero-shot Action Recognition: Learning from Latent Atomic Actions,2
1162,5227,HairNet: Hairstyle Transfer with Pose Changes,2
984,4426,Structure-aware Editable Morphable Model for 3D Facial Detail Animation and Manipulation,2
1523,7127,Privacy-Preserving Action Recognition via Motion Difference Quantization,2
1203,5405,PSS: Progressive Sample Selection for Open-World Visual Representation Learning,2
799,3593,Discovering Human-Object Interaction Concepts via Self-Compositional Learning,2
592,2418,Multi-Person 3D Pose and Shape Estimation via Inverse Kinematics and Refinement,2
133,6185,Look Both Ways: Self-Supervising Driver Gaze Estimation and Road Scene Saliency,2
1328,6068,AnimeCeleb: Large-Scale Animation CelebHeads Dataset for Head Reenactment,2
1245,5584,Sound-guided Semantic Video Generation,2
1241,5561,POP: Mining POtential Performance of new fashion products via webly cross-modal query expansion,2
588,2384,BRNet: Exploring Comprehensive Features for Monocular Depth Estimation,2
162,52,Understanding the Dynamics of DNNs Using Graph Modularity,2
1229,5536,TextAdaIN: Paying Attention to Shortcut Learning in Text Recognizers,2
1344,6144,Improving Few-Shot Learning through Multi-task Representation Learning Theory,2
1345,6145,Deep Semantic Statistics Matching (D2SM) Denoising Network,2
1213,5443,TDAM: Top-Down Attention Module for Contextually Guided Feature Selection in CNNs,2
249,615,Explicit Occlusion Reasoning for Multi-person 3D Human Pose Estimation,2
829,3731,TAFIM: Targeted Adversarial Attacks against Facial Image Manipulations,2
747,3322,Improving Adversarial Robustness of 3D Point Cloud Classification Models,2
1556,7351,Sports Video Analysis on Large-Scale Data,2
317,1002,Weakly Supervised Object Localization through Inter-class Feature Similarity and Intra-class Appearance Consistency,2
1558,7374,SLiDE: Self-supervised LiDAR De-snowing through Reconstruction Difficulty,2
1284,5812,UniCR: Universally Approximated Certified Robustness via Randomized Smoothing,2
771,3452,Overlooked Poses Actually Make Sense: Distilling Privileged Knowledge for Human Motion Prediction,2
1643,8140,Learning with Noisy Labels by Efficient Transition Matrix Estimation to Combat Label Miscorrection,2
1569,7450,VizWiz-FewShot: Locating Objects in Images Taken by People With Visual Impairments,2
777,3484,Unfolded Deep Kernel Estimation for Blind Image Super-resolution,2
608,2542,SiamDoGe: Domain Generalizable Semantic Segmentation using Siamese Network,2
609,2545,Is Appearance Free Action Recognition Possible?,2
1280,5778,Incremental Task Learning with Incremental Rank Updates,2
319,1005,Neighborhood Collective Estimation for Noisy Label Identification and Correction,2
523,2025,SuperLine3D: Self-supervised Line Segmentation and Description for LiDAR Point Cloud,2
1274,5761,GTCaR: Graph Transformer for Camera Re-localization,2
611,2558,DCL-Net: Deep Correspondence Learning Network for 6D Pose Estimation,2
1563,7396,"HVC-Net: Unifying Homography, Visibility, and Confidence Learning for Planar Object Tracking",2
1270,5739,SemAug: Semantically Meaningful Image Augmentations for Object Detection Through Language Grounding,2
215,358,An Embedded Feature Whitening Approach to Deep Neural Network Optimization,2
632,2631,Dense Siamese Network for Dense Unsupervised Learning,2
508,1946,COO: Comic Onomatopoeia Dataset for Recognizing Arbitrary or Truncated Texts,2
1530,7173,ViP: Unified Certified Detection and Recovery for Patch Attack with Vision Transformers,2
1181,5315,Intelli-Paint: Towards Developing More Human-Intelligible Painting Agents,2
746,3314,Unstructured Feature Decoupling for Vehicle Re-Identification,2
1189,5351,Uncertainty Quantification in Depth Estimation via Constrained Ordinal Regression,2
848,3844,DAS: Densely-Anchored Sampling for Deep Metric Learning,2
1173,5266,Radatron: Accurate Detection Using Multi-Resolution Cascaded MIMO Radar,2
496,1859,Efficient Point Cloud Analysis Using Hilbert Curve,2
857,3921,Label-Guided Auxiliary Training Improves 3D Object Detector,2
494,1852,End-to-End Weakly Supervised Object Detection with Sparse Proposal Evolution,2
640,2667,Improving the Reliability for Confidence Estimation,2
1201,5396,Motion Transformer for Unsupervised Image Animation,2
1183,5318,LidarNAS: Unifying and Searching Neural Architectures for 3D Point Clouds,2
1169,5256,Unbiased Multi-Modality Guidance for Image Inpainting,2
850,3867,RIBAC: Towards Robust and Imperceptible Backdoor Attack against Compact DNN,2
1533,7176,incDFM: Incremental Deep Feature Modeling for Continual Novelty Detection,2
1267,5704,Towards Accurate Binary Neural Networks via Modeling Contextual Dependencies,1
1367,6247,Incomplete Multi-view Domain Adaptation via Channel Enhancement and Knowledge Transfer,1
559,2222,Learning Deep Non-Blind Image Deconvolution Without Ground Truths,1
423,1512,GAMa: Cross-view Video Geo-localization,1
1435,6602,Relative Contrastive Loss for Unsupervised Representation Learning,1
173,107,Minimal Neural Atlas: Parameterizing Complex Surfaces with Minimal Charts and Distortion,1
701,3093,MemSAC: Memory Augmented Sample Consistency for Large Scale Domain Adaptation,1
1369,6259,Seeing through a Black Box: Toward High-Quality Terahertz Imaging via Subspace-and-Attention Guided Restoration,1
1436,6615,Personalized Education: Blind Knowledge Distillation,1
343,1118,CycDA: Unsupervised Cycle Domain Adaptation to Learn from Image to Video,1
1039,4705,The Surprisingly Straightforward Scene Text Removal Method With Gated Attention and Region of Interest Generation: A Comprehensive Prominent Model Analysis,1
574,2310,Ultra-high-resolution unpaired stain transformation via Kernelized Instance Normalization,1
1024,4652,Neural Scene Decoration from a Single Photograph,1
1309,5974,Robust Network Architecture Search via Feature Distortion Restraining,1
1296,5914,BoundaryFace: A mining framework with noise label self-correction for Face Recognition,1
698,3058,RDA: Reciprocal Distribution Alignment for Robust Semi-supervised Learning,1
1161,5224,SelectionConv: Convolutional Neural Networks for Non-rectilinear Image Data,1
50,2282,RFNet-4D: Joint Object Reconstruction and Flow Estimation from 4D Point Clouds,1
1291,5901,Object Wake-up: 3D Object Rigging from a Single Image,1
1288,5859,Referring Object Manipulation of Natural Images with Conditional Classifier-Free Guidance,1
1170,5257,Learned Monocular Depth Priors in Visual-Inertial Initialization,1
692,2953,Med-DANet: Dynamic Architecture Network for Efficient Medical Volumetric Segmentation,1
691,2948,Spatial and Visual Perspective-Taking via View Rotation and Relation Reasoning for Embodied Reference Understanding,1
641,2686,Selective Query-guided Debiasing for Video Corpus Moment Retrieval,1
1611,7802,U-Boost NAS: Utilization-Boosted Differentiable Neural Architecture Search,1
53,2526,Contrastive Monotonic Pixel-Level Modulation,1
1149,5157,Learning Unbiased Transferability for Domain Adaptation by Uncertainty Modeling,1
680,2891,Seeing Far in the Dark with Patterned Flash,1
427,1531,MIME: Minority Inclusion for Majority Group Enhancement of AI Performance,1
1174,5270,COMPOSER: Compositional Reasoning of Group Activity in Videos with Keypoint-Only Modality,1
650,2746,Unifying Visual Perception by Dispersible Points Learning,1
1043,4727,When Active Learning Meets Implicit Semantic Data Augmentation,1
297,897,Optimal Boxes: Boosting End-to-End Scene Text Recognition by Adjusting Annotated Bounding Boxes via Reinforcement Learning,1
1221,5491,One Size Does NOT Fit All: Data-Adaptive Adversarial Training,1
1194,5373,CYBORGS: Contrastively Bootstrapping Object Representations by Grounding in Segmentation,1
575,2311,SESS: Saliency Enhancing with Scaling and Sliding,1
582,2337,Symmetry Regularization and Saturating Nonlinearity for Robust Quantization,1
656,2772,Editable Indoor Lighting Estimation,1
1077,4902,Learning Discriminative Shrinkage Deep Networks for Image Deconvolution,1
1198,5388,AutoAvatar: Autoregressive Neural Fields for Dynamic Avatar Modeling,1
1212,5441,Bridging Images and Videos: A Simple Learning Framework for Large Vocabulary Video Object Detection,1
1252,5616,Deep ensemble learning by diverse knowledge distillation for fine-grained object classification,1
397,1382,RCLane: Relay Chain Prediction for Lane Detection,1
1087,4934,Learning Self-prior for Mesh Denoising using Dual Graph Convolutional Networks,1
